,Unnamed: 0,Review,Rating,sentiment
229,229, Still loads of people and beeping horns of little black and yellow taxis everywhere - bit like Bali road rules are just guidelines - they basically do what they want to and go where they want to.,0,1.0
230,230, First we were thinking about going to Goa but that was a little bit of crazy idea considering that we had just 4 days including the journey and flight tickets were extremely expensive.,1,0.0
231,231, not having to bribe the security guys who insisted I have to pay to get back and I found a travel agency which got us a car with a driver for our journey to Kashid for a reasonable price.,1,1.0
232,232, he was expecting it to be shorter journey as well.,1,1.0
233,233,So Friday morning I had the pleasure of walking up knowing I only had a few hours before a mammoth 26 hour train journey to Mumbai to get.,1,1.0
234,234,"I headed to the station a good hour before the train as I know the things are huge,",0,1.0
235,235, I got onto the train and went to my sleeper.,0,0.0
236,236, especially on moving transport as a jolt means it goes everywhere.,0,0.0
237,237, and had a few scoops before heading to sleep with an early train in the morning.,0,0.0
238,238,by a 4 hour train to Pune.,0,0.0
239,239, It was obviously uncomfortable and hot as Indian trains always are and we were in second class seating (cheap seats).,1,0.0
240,240, After a bit of a tiff on the side of the road we got in a rickshaw.,0,0.0
241,241,transport links to it.,0,0.0
242,242, 2 off those and a curry and we headed to train station to find a cab.,1,1.0
243,243," There are plenty of road side stalls but with the dirt,",0,0.0
244,244,Friday all we did was get some food and hang around until our train back to Mumbai.,0,0.0
245,245," In the evenings I went about 2 doors down the road to a place called Cafe Universal and sat there eating,",0,0.0
246,246,I had booked a train months ago for Wednesday to Delhi.,1,1.0
247,247," Having done the Chennai-Mumbai trip on sleeper class I tried to book a new train to Delhi in 2AC class which is far nicer however 4 times the price,",1,1.0
248,248,"not enough to make the train so I knew Id have to wait an extra day in Mumbai and go cattle class,",1,1.0
249,249, hence why Id tried booking an earlier train in a nicer class.,1,1.0
250,250, It seems a strange book to read here but after such a spiritual journey book such as The Alchemist I felt the need to get back to some reality and science.,0,0.0
251,251, Instead Max gave me an Italian lesson which was just as good and then we hit the road back home.,0,1.0
252,252, After tea we all sat through those last two lessons of our yoga teaching training and two hours later we were sort of free.,0,1.0
253,253, From there far to many people from my yogi family will head out to continue their journeys onward or back home.,0,0.0
254,254,During the day we also saw the Victoria Terminas which is one of the largest train stations in the world.,0,0.0
255,255, India has an amazing train system which has developed over hundreds of years.,1,1.0
256,256," Our drive to the Cinema Hall passes Victoria Terminus (the magnificent British built train station),",0,1.0
257,257, that local trains run every 2 minutes and stop for only 17 seconds.,0,0.0
258,258," transported to the port,",0,0.0
259,259," we took a train that had no doors,",0,0.0
260,260,"We went back to the hostel with intentions of booking a train ticket to Goa but instead fell asleep for 4 hours,",1,1.0
261,261,The next day the hostel staff told us that the trains to Goa were fully booked but they found us a night-bus that we could take that evening.,1,1.0
262,262, We continued our walk passing India´s and possibly Asia´s largest and busiest train station.,1,1.0
263,263," I stepped off the train at midnight onto the empty platfrom of Mumbai's Victoria Terminus - the busiest train station in Asia,",1,0.0
264,264, The most impressive of all the buildings is the train terminus that I'd blindly left the evening before.,0,1.0
265,265," I bravely commanded a spot in the middle of the wide road to take anoptimally angled photograph of the front of the building only for a rage of taxis,",0,0.0
266,266, I took the new suburban train service to the nearest station.,1,1.0
267,267, The squat slum settlements that illegelly but indefatigabally line the rail lines whizzed past as I hung out of the open doors to enjoy the cooling breeze (still a novelty and one that I'll miss when I return to the tragic Southeastern train service of Kent).,1,1.0
268,268, and consequently came within 3 or 4 seconds of being obliterated by a train - they are surprisingly quiet!,0,0.0
269,269," on the return journey dad was waiting for us at the airport as mom,",0,1.0
270,270, we left for mumbai by train and one of the friends uncle met us at dadar station and we walked down to a guest house nearby.,1,1.0
271,271, we stayed at the ywca international guest house on madame cama road and this would be one of several trips to the ywca.,1,1.0
272,272, i moved into a sharing accommodation and settled into a routine job for all of five months before moving into my uncles house in carter road and moving back to kolkata.,0,1.0
273,273, living in mumbai was a bit overwhelming and i now realise i just didnt have it in me to travel by local trains and live in a pg for months at end until i found my groove.,0,0.0
274,274, on one of these trips i would travel all the way to bandra kurla to catch a train back home.,0,0.0
275,275, some strange impact and circular life forces would compel me to make this journey and theres not much to write about it.,0,0.0
276,276,5 hour journey through Mumbai's slums and to the ashram started.,0,0.0
277,277,The morning flew by quickly and lunch was served and then Nathalie and I headed out in the van of the transportation man (free ride to town but we had to tip him ) to the town.,1,1.0
278,278," The roads were all broken and covered with dirt,",0,0.0
279,279, but if you saw straight ahead you did not see this instead you saw a street with tall trees on each side of the road and so tall and full of leaves that they made a natural tunnel.,1,1.0
280,280," Our bus dropped us off on the side of a highway leading into the city,",0,0.0
281,281," For here the main roads throng with high-revving tuk-tuks,",1,1.0
282,282, However mostly people get down at Malavali railway station and walk two kms on tar road to Bhaje village.,1,1.0
283,283, take the bridge over the expressway and the road will end at the bhaje village.,0,0.0
284,284, you can take shortcuts and miss most of the road and motor cycles (we did and it was fun!,0,1.0
285,285," you will find a tar road (it seems the road connects to lonavla) ,",1,1.0
286,286, A km on this road will take you to a resort under construction.,1,1.0
287,287,The roads were not bad especially the main bit from about midway onwards (after the windy bits across the Ghats) where we were on dual carriageways all the way.,1,1.0
288,288,We detour off the main highway to take the slow and bumpy road to visit the Aiknath Temple dedicated to the saint whose remains are in the shrine.,1,1.0
289,289, all the rides are closed so all he gets is the simple playground and some rather uninspiring water gardens and then we get back onto the road for our hotel.,1,1.0
290,290,We decide to do the Ellora trip first as its only 30 kms from Aurangabad to give us an easier day in the car after our long journey from Satara as the trip to Ajanta will be a long day.,0,1.0
291,291, his Mum and the car at the back  thankfully with some water from a kind village lady by the road side.,0,1.0
292,292," As we face a long journey back to Pune (and even longer for Girish and family as they go on to Satara) we stop off briefly at a warm (AC not working) Café Coffee Day for coffee and snacks then hit the road again arriving late in Pune at 6-30pm to stay with Satishs aunt,",1,1.0
293,293,Girish and his family depart after a brief stop at Shobhas place after which we and S take to the road to find the local beer shop (Beers Rs 105 each here).,1,0.0
294,294,And so finally we reach the end of our travels with Satish and we head off to Pune station for a 33 hour train journey to Kolkata.,1,1.0
295,295,"Trains will transport us from Delhi to Shimla,",0,0.0
296,296,"Join us as we begin our 35 day journey north,",0,1.0
297,297," noisy and inefficient train station,",1,0.0
298,298, train to Arambol Beach in Goa.,1,1.0
299,299,After we found some amazing amazing graffitties on the road near Colaba.,1,1.0
300,300," You can try that petit Train those who never did it in Dehradoon,",1,0.0
301,301, I leisurely sit back in my sedate transport and bathe in the fumes of all the other autos whizzing past me.,0,0.0
302,302," when every minute spent putt-putting down the road could be a minute spent on the dance floor,",0,0.0
303,303," the journey between them takes at least 45 minutes,",0,0.0
304,304, clearing the road in front of us.,1,1.0
305,305, I return to India for eight weeks to continue training for the Starbucks India Partners and to work alongside them in our three glorious stores in Mumbai.,1,1.0
306,306, transportation and meals.,0,0.0
307,307, This will be my first journey alone as well as my first journey to India.,1,1.0
308,308,"To prepare for my journey I have been watching movies like Slumdog Millionaire,",0,1.0
309,309, So when I chose to go on this journey to India I knew I had to work in the slums.,0,0.0
310,310," I read on Global Road Warrior,",1,1.0
311,311," and all the photos taken on the road to the caves,",0,0.0
312,312,Now I head back to Delhi to start my black belt training in 6 Sigma.,0,0.0
313,313," It was then that I also had my first experience on an Indian train; in cramped compartments and families taking care of crying babies,",1,1.0
314,314, To see a man laying half dead in the street while everyone passes him by and an elderdely woman lying helpless in the street is hard to consume as is seeing kids shooting up at the side of the road and children no older than 4 or 5 out at night time begging for money when they should be safe in a place we call home .,0,0.0
315,315, As we wanted to get a real feel for the place we decided to take the local train from the North to the South.,1,1.0
316,316," You know those pictures you have seen of people running across the track when trains are coming,",1,1.0
317,317," the busiest train station in Mumbai,",1,1.0
318,318," steam trains of the Great Indian Peninsular Railway travelled as far as Delhi,",0,1.0
319,319,"With many long-distance trains now departing from Mumbai Central,",0,0.0
320,320, this is the commuter hub for the city and the trains are packed fuller than any I have ever seen.,1,1.0
321,321," I am fascinated with the trains here which despite being elderly and very well used,",1,1.0
322,322, Most large train stations here have a fabrication shop either on site or close by where parts are manufactured from scratch for these behemoths.,1,1.0
323,323, The trains are being modernized now across India but I still feel theres a certain romance with an engine which just keeps on working despite the fact that it is thousands of miles from the factory where it was first created and the spare parts it needs are found more in museums than hardware stores.,1,1.0
324,324, Im just a big kid at heart) and the train pulled away only to be replaced by another just minutes later.,1,1.0
325,325," The highway was packed and oh so noisy,",0,0.0
326,326," It was as if seven lanes of traffic were packed into a three lane road but it didnt seem to phase anyone,",1,1.0
327,327," Coming off the highway and onto the surface streets,",0,0.0
328,328, The road had many steep hair-pin bends and is relatively empty.,1,0.0
329,329,"off here to break up the journey to Delhi,",0,0.0
330,330," This was about as good as Shimla got so I took the train to Delhi,",1,1.0
331,331," which is technically a train station but looks more like Notre Dame and is very gothic,",0,1.0
332,332, you could spend a lifetime travelling India and discover something new each time to step off a train or bus.,0,1.0
333,333, transport is efficient and with prices that would make British rail weep.,0,0.0
334,334, I had a few train mishaps (which never happens to me just going to college!,1,0.0
335,335," Then apparently I took a weird train and had to take another one,",0,0.0
336,336," We couldn't find any taxi's so we ended up trekking to the closest train station in the rain,",1,1.0
337,337," I listened to the song 'Chaiyya Chaiyya' on the train (bollywood song from the 90's) which I thought was pretty cool,",1,1.0
338,338, Kind of cool but pretty annoying if you're sitting in the next compartment for half an hour (my train time to college.,0,1.0
339,339,I caught an evening sleeper train from Varanasi which arrived at Bhopal at 8am the next morning.,0,0.0
340,340, I had decided to stop for a while in Bhopal mainly to break the journey from Varanasi to Mumbai so I had booked two separate sleeper trains to do the journey.,1,0.0
341,341, I walked around a bit to have a look at the lake views - Bhopal is built between two lakes - then headed back towards the railway station to sit and read in the upper class waiting room until my next train arrived at about 6pm.,0,0.0
342,342, the long road and sea embankment that marks Mumbai's south western edge.,1,1.0
343,343, Unmanned metal detectors stand sentinel at every train station.,0,0.0
344,344, 34 of which would be spent in a train to Kolkata.,0,0.0
345,345," I rolled in on an overnight train from Delhi,",0,0.0
346,346, preparing myself for the horde of drivers who normally wait like vultures for dying prey at the exits of train stations.,0,1.0
347,347, I had to go out to the road and actively look for a rickshaw.,1,1.0
348,348, I finally found a driver willing to take me to Yari Road and tried to negotiate a price with him  but he wouldnt have it.,0,0.0
349,349, And I loved that there was a Cinnabon facing the sea on Carter Road  globalization never tasted so sweet!,1,1.0
350,350," congested roads rather than walk on sidewalks composed of loose bricks,",0,0.0
351,351, Their windows looked out onto the training field of the nearby police academy.,1,1.0
352,352, seeing a monkey in a train station (did I mention that already?,0,0.0
353,353, I can hardly cross the road lol).,0,0.0
354,354,We zeroed out on Mumbai Bangalore highway as our route that takes us thru Pune - Satara to Kolhapur where we had planned to halt for overnight stay.,1,1.0
355,355,We hired auto from the road across and went to the temple.,0,0.0
356,356,"We did that and started our journey towards Margaon,",0,0.0
357,357,All in all quiet a plesant journey from Kolhapur to Amboli.,0,0.0
358,358," Road to the point from the main road is quiet bumpy but once you reach the destination,",0,1.0
359,359,approach road is quiet bumpy.,0,0.0
360,360, we continued our journey to Goa from there.,0,0.0
361,361,We even went to the Margaon railway station and inquired for the train option but it turned out to be impractical.,0,0.0
362,362,The road goes parallel to train track for almost 20 mins before you get off and pick up a jungle trail.,0,1.0
363,363, It was a long road and navigating thru dark was making it difficult.,0,1.0
364,364," Thankfully we found a cheaper but still nice hotel just down the road that had some availabilites,",1,1.0
365,365," train concession,",0,0.0
366,366, some other experiences I'm pretty proud of is taking the rickshaw and train alone to school and back!,1,1.0
367,367," Ok well maybe I'm taking first class and go in the ladies compartment on the train (s/o to my french homies who take the men's second class),",1,1.0
368,368, and it's still cheaper than taking public transport in Canada.,1,0.0
369,369," On the trains I have seen some eunichs and a lot of little boys sneaking on to the ladies compartment,",1,1.0
370,370,was R460 (about £8)  for a 45 minute taxi journey in the early hours of the morning I didnt think was too bad.,0,0.0
371,371,"The journey was a real eye-opener,",1,1.0
372,372," transport routes,",0,0.0
373,373,First on the to do list was to get my train ticket booked.,0,0.0
374,374, Next up is the 10hour train journey to Ahmedabad.,0,0.0
375,375, I hadnt yet utilized that mode of transportation and I wasnt quite sure how the system worked.,1,1.0
376,376, but I still hadnt fully processed that information when I saw a train departing from Platform 4.,0,0.0
377,377, It was at that point that I saw the train heading towards Churchgate pulling into the platform opposite me.,0,0.0
378,378, I wasnt sure that I hadnt preferred the hectic journey to its destination.,0,1.0
379,379," riding the local trains in Bombay is a Must-Do for any foreign visitor,",0,0.0
380,380, so that you can hop off before the train has come to a complete stop.,0,0.0
381,381, youll avoid being pushed back into the train with the oncoming crowd.,0,0.0
382,382,Its only at these moments of getting on and off the train that Ive seen Indians lose their composure and become absolute crazy people.,1,0.0
383,383, in trains as in life.,0,0.0
384,384, Had a coffee then headed out to MG Road with a friend.,1,1.0
385,385, We entered by scooter off one of the main roads and straight away you are on dusty lanes about 3-5 metres wide.,0,1.0
386,386, Before I go into our kolkata journey I will briefly tell about our day in mumbai- aka bollywood.,0,0.0
387,387,"Predicament: Do I risk getting ill in the middle of a car journey when my immune system probably isn't at its best,",1,0.0
388,388, State Transport (ST) buses run between Dapoli and Panhalekaji.,0,0.0
389,389, people hanging out of buses & trains & cows in the street sharing food with goats & humans ;-s lol oh & the smells!,0,1.0
390,390,The journey of human race is the saga of their strong survival against the most difficult situations & living environments.,0,1.0
391,391, off on the road again on the bikes.,0,0.0
392,392, I am glad we got the Scooter this time as it was comfier and my backside felt quite bruised at this point from all the bumps we had gone over on these roads the day before.,0,1.0
393,393," Training is going really well,",0,1.0
394,394, We also went Air Rifle Shooting ( I am sure the sights were out lol) that was a great laugh and then set off on the journey home in the dusk.,1,1.0
395,395," Many of these business are actually road shacks that are,",1,1.0
396,396,"We had arranged to meet up with the EXL team the following day to go to the Palace and then off to Laxmi Road Market,",1,1.0
397,397,"I have started this journey with a very open mind,",0,1.0
398,398," Renting motor bikes and taking the open road everywhere we can,",0,1.0
399,399," Rakesh and the guys took me in the car for a bit of a hair raising journey to the restaurant,",0,0.0
400,400, No cars are allowed within this town so that the main modes of transport are either walking or on horseback.,1,0.0
401,401, where we will start our Rickshaw Run on April 8 after a couple days of training and bonding with the other participants!,1,1.0
402,402,This was exactly the mid point of our journey in every way- Distance and Time!,0,0.0
403,403, relaxing and enjoyable provided you are in no rush; For while you are serenaded by the coastline post Revdanda; on two occasions you crawl through narrow village roads- first after Karnala when you drive through Pen and second- just before entering Murud when you drive through the narrow and rustic lanes of Nandgaon.,1,1.0
404,404,Having taken in the sights and sounds of our 170 km journey we drove into Golden Swan Resort fifteen minutes past noon.,1,1.0
405,405, The journey had taken us 4 hours plus a 45 minute halt for breakfast at Kamath's.,0,0.0
406,406, training is going brilliantly and my learners are so nice.,0,1.0
407,407,I was planning my diet regime & training schedule.,0,0.0
408,408, Many have said to trek here as a part of their training programs for Himalayn Expeditions.,0,0.0
409,409,We gathered at Katraj Snake Park and took a local transport bus to the tunnel.,1,1.0
410,410,"The hike is as good as journey of ones life,",0,1.0
411,411, We had arranged for local transport from the junction to the city.,1,1.0
412,412, Praj took care of all the train bookings.,0,1.0
413,413,The grewling 12 hours that lay ahead would find each of us toughing out another train ride to Nagpur.,0,0.0
414,414, then there were some that are still poping Imodium - its going to be a tough road getting back into the rich western food.,0,1.0
415,415,<span>Please pray for safe journeys back to the boys school.,1,1.0
416,416, We are all in the same class on the train this time which could be a bad or good thing?,0,0.0
417,417, This is Kirsten and Soren (currently on a train) filling you in on what happened two days ago.,1,1.0
418,418,This is Soren and Kirsten signing out from a bumpy train heading back to Nagpur.,0,0.0
419,419,"We were up at 6 am on the train ride,",0,0.0
420,420,<span> They all had lined up on either side of the road and we got the same enthusiastic welcoming that we did at the boys school.,1,1.0
421,421,"Our train didnt depart Nagpur until the evening  7:10pm to be exact,",0,0.0
422,422, A few members of the team were feeling a little heat stroke so it was important to take a lot of down time before our train ride.,1,1.0
423,423,The train station was a gong-show.,0,0.0
424,424, but you just have to know the seats you booked and find them when the train arrives and hope that no one is already sitting there.,0,1.0
425,425,Our train arrived and we found our seats/beds quickly.,0,0.0
426,426, Because the train was over night most of us slept.,0,0.0
427,427, Chai being yelled through the train car  for a few rupees you could have hot chai  really hot!,0,0.0
428,428," 3 months on the road to Paris India,",1,1.0
429,429," We caught the first launch of the morning from the landing stage near the Gateway of India and the journey to the island,",1,1.0
430,430," There is a little train that transports you from the village back to the jetty at a cost of 5 rupees each and,",1,1.0
431,431, Wednesday is surely going to be an interesting day - train departs at 7:10pm.,0,1.0
432,432,Please pray for the train ride.,1,1.0
433,433, have adapted to new adventures very well but the train is a whole new adventure.,1,1.0
434,434, We ask that God would calm our anxious minds and that He would keep us safe throughout the journey as He has done so faithfully already.,0,1.0
435,435, Wednesday is surely going to be an interesting day - train departs at 7:10pm.,0,1.0
436,436,Please pray for the train ride.,1,1.0
437,437, have adapted to new adventures very well but the train is a whole new adventure.,1,1.0
438,438, We ask that God would calm our anxious minds and that He would keep us safe throughout the journey as He has done so faithfully already.,0,1.0
439,439,We then visited the Jain Temple in Walkeshwar Road but it had already closed for the aftenoon.,1,1.0
440,440," The museum is set in the house at 19 Laburnum Road where Ghandi undertook one of his historic fasts,",0,0.0
441,441, Their lunches are made after the workers have left for work and sent in special canteens (or tiffin boxes) to the city by train and then have to be delivered.,1,1.0
442,442, WE even got to experience the underground commuter train between terminals.,1,1.0
443,443," The roads here are generally poor and incredibly dangerous,",0,0.0
444,444,with the help of the brilliant owner of the Manoribel who sorted our transport all the way to Panvel Station on the other side of Mumbai (and then some) and organised an early breakfast for us.,1,1.0
445,445,"From Mumbai we boarded the Kerala train to find wed been down-graded due to faulty carriages from 2-tier AC to 3-tier AC (made us feel right at home,",1,1.0
446,446," The journey was uneventful apart from having to share the overnight portion with a rather deaf old gentleman,",1,1.0
447,447, but part of the joy of communal overnight train travel.,1,1.0
448,448,Sheela and took a stroll to collect her son Abhishek from his school not far down the road from her house.,0,0.0
449,449, The train to Kerala was huge and it is well catered.,0,1.0
450,450, The journey was to take about 30 hours.,0,0.0
451,451, 5th March: Today we left the hotel and we got on the sleeping train to Kerala.,1,1.0
452,452, 5th March: We go to Platform 7 of Panvel Station and board a train to Kerala.,1,1.0
453,453, We will be on the train overnight because it is a super long journey.,0,1.0
454,454, 6th March: We get off the train at Kochuveli.,1,1.0
455,455," that we already have tickets for an overnight train to Delhi,",0,0.0
456,456," which is our last long journey on this trip,",0,1.0
457,457,"To say the road was bumpy,",0,0.0
458,458," we did when the road turned less bumpy,",0,0.0
459,459, the old Victoria train station.,1,1.0
460,460," we said goodbye to Mumbai after 2 days and set for a 19 hour train journey to Pushkar,",1,1.0
461,461, I noticed a pizza bar along the airport road which was pleasing.,1,1.0
462,462, After a pleasant if spicy dinner at the hotels restaurant I wandered across the road to get on the internet and to indulge in a couple of large bottles of beer before returning to my room to watch a bit of TV.,1,1.0
463,463," Le trajet en train a bien été,",0,0.0
464,464," On se tape un autre train de nuit ce soir,",1,1.0
465,465, these docs have trained themselves to manage both adults and children in the inpatient setting.,0,0.0
466,466,"medical school training the Indian way,",0,0.0
