,Unnamed: 0,Review,Rating,sentiment
467,467,"This train-station dog appears to be eating enough,",0,0.0
468,468, the people of Mumbai are so incredibly friendly that I was able to hop from train to train with a great deal of help and little inhibition.,1,1.0
469,469," Unfortunetly we were unable to book a train ticket to the Taj Mahal for when we needed it,",0,0.0
470,470, MG Road is a main shopping area.,1,1.0
471,471, this has been our longest transportation day so far.,1,1.0
472,472, Getting to the airport took more than an hour by Sky Train and Airport Express train (both of which were quite packed).,0,0.0
473,473, It has made long journeys a breeze.,0,1.0
474,474, I suppose their real experience comes during the post-MBBS training they receive.,1,1.0
475,475,trap Indian roads it was nice to be somewhere with a little peace and quiet and well off the tourist trail.,1,1.0
476,476, British built Victoria Terminus train station which I sadly only saw from the outside and didnt get any photos.,0,0.0
477,477, Im sure I overpaid but at the equivalent of 5 GBP for about a one hour journey I didnt feel too hard done by.,0,1.0
478,478,The great train station seething with people and machines.,0,1.0
479,479,On the road I was in for a shock!,0,0.0
480,480,walked for about five minutes (me wearing handkerchief over my nose and mouth) trying to hug the edge of the road even as we walked past parked taxis and motorcycles.,0,1.0
481,481,"Mumbai began with a 24-hour train ride from Bangalore in Sleeper class,",0,0.0
482,482," which is my personal favourite train class because you get to see so much more  and,",0,0.0
483,483, We arrived first thing in the morning and grabbed a taxi who said he would use his meter to take us from the train station to the Salvation Army hostel (more on that later!,0,0.0
484,484," but only 50rupees in a taxi down the road from India Gate,",0,0.0
485,485," Especially the guy who follows me for about a mile down the road banging a small drum """"madam you want drum,",0,0.0
486,486," but were somehow so tired that we basically just asked a Ricksaw driver to take us to the nearest cafe on Linking Road (a big shopping street) where we stayed all afternoon,",1,0.0
487,487,Tomorrow we are continuing our journey towards the City of Light - Varanasi.,1,1.0
488,488," We are going to travel by train for 30 hours,",0,0.0
489,489, We are very excited about our upcoming journey and stay in Varanasi - so stay tuned.,0,1.0
490,490, After that we took a Rickshaw (a TukTuk for the ones who have been in Thailand) to the nearest train station in Andheri where we took the train towards Churchgate where we had found a hostel which we wanted to stay in (Hotel Lawrence).,1,1.0
491,491," Going by train was really comfortable,",0,1.0
492,492," we went with train (felt more like a S-Bahn/Metro) for more than 1 1/2,",0,1.0
493,493, insane - our trick to not get run over is to follow the Indians when they are crossing the road - traffic lights are not always to be trusted.,0,1.0
494,494, In a few days we'll start our journey up north - so more exciting things ahead.,0,1.0
495,495, There is a hierarchy on Indian roads and it became quickly obvious that the bigger the better.,1,1.0
496,496," We drove a very different way along the seafront and saw the richest parts of Mumbai but further into the journey came a stark contrast as we passed homes built of sticks and blankets on the side of busy freeways,",0,1.0
497,497, the driver slammed on the brakes when a fight broke out on the road in front of us and someone went flying across the bonet of the battered car.,0,0.0
498,498," and walked towards the famous Chatrapati Shivaji train station,",1,1.0
499,499," The traffic around the train station was mad with tons of cars and bikes beaping their horns as it was on a busy junction and trains leave here to all over India,",1,0.0
500,500,We planned to take an overnight train but couldn't get a ticket for the date/times we wanted.,1,1.0
501,501,) Again in fairness it was about the same as first class on a train so there really isn't too much room to complain here.,0,0.0
502,502,"Applying infinate wisdom comparing trains and buses when we selected our sleepers,",1,1.0
503,503, It sounds great in theory and if this was a first class train cabin it would have worked perfectly.,1,1.0
504,504, I've heard guys who snore and make it sound like there's a freight train running through.,1,1.0
505,505, The driver even had a small road rage incident where a man got a baseball bat out of his car and started tapping the windscreen of the bus accusionally.,1,0.0
