,Unnamed: 0,Review,Rating,sentiment
559,559," The palace was very beautiful with brightly painted ceilings and columns,",1,1.0
560,560," since the floor had obviously not been cleaned in quite awhile (if ever),",1,1.0
561,561, Apparently it's perfectly fine to speed around blind curves while going up a mountain past other buses that are coming down.,1,1.0
562,562," Since it was a hazy day and the view wasn't wonderful,",0,0.0
563,563,"Interesting fact: apparently (and quite unfortunately) we barely missed a harvest festival in Mysore where they paint all the cows yellow and their horns various colors,",1,1.0
564,564," On a eu une belle surprise en découvrant une ville assez calme (sauf la Station Road évidement),",1,1.0
565,565," One can view ruins of impressive buildings and temples,",0,1.0
566,566," we were surrounded by school children on field trips who were fascinated by us,",0,1.0
567,567, beautiful smile.,0,1.0
568,568, the wideness of the main streets made the traffic less daunting.,0,0.0
569,569, I am glad to have found myself in the middle of such a vibrant and bustling and beautiful mess.,1,1.0
570,570, apparently beautiful at night.,0,1.0
571,571, More beautiful things to see.,0,1.0
572,572, traffic increased.,0,1.0
573,573, we saw another crowd of people.,0,0.0
574,574, I am grateful that every accident we saw was met with by a crowd of good Samaritans.,0,1.0
575,575, and less litter than other places we have been to in India.,0,0.0
576,576," The hotel has an amazing view of the old sandstone fort from the rooftop,",1,1.0
577,577," Here every building has beautiful patterned stonework,",1,1.0
578,578, traffic d'enfer.,0,0.0
579,579, and we ended up sitting in one of the last cars alongside a group of beggar children and an elderly man who appeared to be with them.,0,0.0
580,580, showing us to our incredibly spacious and clean room and then serving us masala chai in her living room.,1,1.0
581,581, that the holy beach is not really a good place to hang out or swim because it is littered with trash and cow pies.,0,0.0
582,582, since the other beaches in the town are very clean and beautiful.,0,1.0
583,583, Weve come to realize during our time in India that littering is widely practiced and accepted  its simply part of the culture.,1,1.0
584,584," Unlike Americans who are raised on the notion that littering is unacceptable and bad for the earth,",0,0.0
585,585, I have to remind myself that this culture I have chosen to immerse myself in is beautiful in as many ways as it differs from my own.,1,1.0
586,586,Another cultural difference between India and America is its view and treatment of cows as holy creatures.,0,0.0
587,587, or even on the beaches if they like.,0,1.0
588,588, we spent one full day exploring nearby Kudlee Beach and Om Beach.,1,1.0
589,589, We followed the trail from the town and reached the first beach in about half an hour.,1,1.0
590,590, We then walked along the water until we reached the trail that led to Om Beach (which is actually shaped like an Om symbol).,1,1.0
591,591, It was nice to find this beach to be far less crowded and touristy than Arambol.,1,1.0
592,592, Side note: never in my life have I been in a holy city and seen so many grown men walking the streets and beach in their underwear.,0,0.0
593,593," We found some amazing views of the surrounding landscape,",1,1.0
594,594," people from small villages viewed me as a novelty and wanted their picture made with me because Im whitefunny,",1,1.0
595,595, It gives the country a relaxed feel but its hard for us British to adapt.,0,1.0
596,596,I have mentioned the traffic and driving skills a few times in the blog already and Emily has also added a whole post dedicated to the transport here.,0,1.0
597,597, beautiful silks and a nice lifestyle.,0,1.0
598,598, people take credit to furnish their homes with beautiful furniture and go on nice holidays.,1,1.0
599,599, But I challenge them to work full time and then come home to cook and clean and pay bills (And that isnt even taking into account looking after the children!,1,1.0
600,600, The incessant rhythmic honking of car horns.,0,0.0
601,601, Mosque wake up calls (there may only be a 10% Muslim population here but that's still 100 million).,0,0.0
602,602, Cows knee deep in street rubbish somehow eking out an alternate food source to grass.,1,1.0
603,603," noise and smells are brutally left field from Woolworths,",0,0.0
604,604, as if a force field exists to keep large hotel chains and anything else remotely upmarket at arms length from this world heritage area.,1,1.0
605,605, the most beautiful rice paddies amongst elephant size boulders.,1,1.0
606,606," The orchids were gorgeous and they gave us each a stem to take,",1,1.0
607,607,orchids in mist spray.,1,1.0
608,608, This practice is not recommended by the Government as it can cause damage to vehicles and pollute the crops with diesel.,0,0.0
609,609," with beautiful carved stone pieces,",1,1.0
610,610,After Shimogga we returned to Mangalore through beautiful countryside.,1,1.0
611,611, The hospital looked very clean and tidy.,0,1.0
612,612,"Our trip to Karkala also took us to a beautiful waterfall for a picnic,",1,1.0
613,613," Ananthakrishna and his wife Raja had a beautiful home,",1,1.0
614,614," When viewed in full costume and make-up and seeing them run towards you bearing swords,",1,1.0
615,615," It was very peaceful and relaxing sitting in the sunshine at the base of the falls,",1,1.0
616,616, We almost had to be dragged away from the scenic beauty of the falls and the national park.,0,1.0
617,617, which we believe will be somewhat more relaxed (well soon find out if this is the case!,0,1.0
618,618, the noise and the litter.,0,0.0
619,619," We dont notice the noise or the litter anymore,",0,0.0
620,620, the traffic feels calmer and we cant wait to eat the Mangalore food and see some of our old friends!,1,1.0
621,621," Although we got to relax and meet friends at the venue on Friday night,",1,1.0
622,622,Sunday was a chance to relax and perhaps overindulge.,1,1.0
623,623, Its all worth it for the views though!,0,1.0
624,624, The elephants all had seats one op for ther people to ride up the hill but we walked as the view is quite majestic and hoestly it seemed cruel what they were doing to the elephants in thsee conditions.,1,0.0
625,625, we got to see some beautiful architecture and imagine what life would have been like back in the day.,1,1.0
626,626," There were rooms for Royal viewing sessions,",1,1.0
627,627, rooms for the concubines of the Mugul and rooms that seemed to have no reason but were spectacular none the less.,1,0.0
628,628, Quite a spectacular building set out ins he middle of a man made lake for the relaxation and summer enjoyment of the moguls.,1,1.0
629,629, They are beautiful structures with amazing history and beautiful designs.,1,1.0
630,630, it was great to see such beautiful animals up close and personal.,1,1.0
631,631, We also get a chance to visit Shivappanayaka Palace where there are some beautiful wood carvings.,1,1.0
632,632, we have been staying in the beautiful coffee region of Belur.,1,1.0
633,633, I took in fantastic views of the city and the gommateshvara statue.,1,1.0
634,634, I started reading the best book about yoga I have ever come across and was inspired by his views on yoga and meditation.,1,1.0
635,635, I felt it was a place where I could spend some quiet time reflecting on what we have experienced so far on our journey.,1,1.0
636,636, Programmes that focus on population stabilisation also continue to be implemented.,1,1.0
637,637," Belur temple is very beautiful and inside,",1,1.0
638,638," Janhavi has given us some beautiful gifts,",0,1.0
639,639, The house is packed full of beautiful pieces of antique furniture and books about foreign destinations they have visited.,1,1.0
640,640,"We need to get up early to enjoy the views at the top of Shravanbelagola,",1,1.0
641,641, This area seems to have a bigger Muslim population as we see men in traditional dress on the streets.,1,1.0
642,642," we come to Mysore and discover traffic lights,",0,0.0
643,643, traffic police and CCTV cameras checking on road use.,1,1.0
644,644," So you see traffic waiting at junctions to allow others to cross,",0,1.0
645,645,"Mysore is a beautiful city,",0,1.0
646,646, The current palace is full of beautiful carved doors and ceilings and interesting murals of events in the lives of the royal family.,1,1.0
647,647, It seems quiet on our visit and we are told this is the effect of the recession in the west.,1,0.0
648,648, The palace itself is beautiful and well maintained.,0,1.0
649,649," I dont mind at all as they spend more than an hour wrapping me in some beautiful silk,",1,1.0
650,650," There are some beautiful pieces here,",0,1.0
651,651," The rickshaw drivers disperse and the touts and shops appear all selling beautiful toilet paper,",1,1.0
652,652, After grazing we always went back to our roof after enjoying a few cool hours in the beautiful rooms.,1,1.0
653,653," a peaceful chap who seemed to behave for the entire trip,",0,1.0
654,654, The process of creating beautiful saris from the spit of silk worms is fascinating; especially the gold threads which make them appear extra special.,1,1.0
655,655, We are all a bit like kids in a sweet shop looking through the beautiful colours and designs.,1,1.0
656,656," Even the poorest people here are dressed beautifully and when we ask about second hand shops,",1,1.0
657,657, and then a church and reservoir with a beautiful temple and hotel for lunch just for good measure!,1,1.0
658,658," As more and more of the population become literate,",1,1.0
659,659, The view is beautiful.,0,1.0
660,660, I then went to a party on the family who runs peace child farm which is on the out skirts of Bangalore.,1,1.0
661,661, relaxing and playing cards.,0,1.0
662,662,"No matter how many times I come to an Indian beach I douth i'll get use to cows on the beach,",0,0.0
663,663," crowds and a lot of men,",0,0.0
664,664," Sat on the luggage rack above 6people on a beach for 3 Tamzin and I listened to our ipods and some became the subject of everyones conversation,",0,0.0
665,665," Mandala Beach Huts,",1,1.0
666,666," I have seen some beautiful Saris,",0,1.0
667,667," If you could see the traffic and the public bus services,",0,0.0
668,668," We have also heard about work in the field of health and helping youngsters with solar lamps for when there are power cuts,",1,1.0
669,669, It is hard to describe how unconscious they are of anything like traffic lanes.,0,1.0
670,670, particularly with victims of road traffic accidents.,0,0.0
671,671,"With a population the size of my county (Cumbria),",0,0.0
672,672," The temples are beautiful and even though they are a tourist attraction,",0,1.0
673,673, they are quite peaceful and me and Di spend some time sitting cross legged on the floor taking it all in.,1,1.0
674,674,The one disappointing thing about India is the rubbish which lines every street and roadside.,1,0.0
675,675, Its no different here and this beautiful river has its banks spoilt by litter.,1,1.0
676,676, They tents used as the accommodation are beautiful inside and this looks like a great place to come for a relaxing weekend away.,1,1.0
677,677,"As we all got up early to go to the beach and paddle,",0,0.0
678,678, We looked at the beach huts and watched the jet ski's.,1,1.0
679,679, as well as having a beautiful guest house.,1,1.0
680,680, I have never seen so much beautiful wood in one home!,1,1.0
681,681, like rubbish collection.,0,1.0
682,682, the only police I have seen are traffic coordinators.,0,0.0
683,683, a beautiful bracelet and some local cashew nuts.,1,1.0
684,684," Mithra gave me a beautiful candle made in Udupi and a book about acupressure,",1,1.0
685,685, It really is a beautiful city.,0,1.0
686,686, (Mitra and Mr Shetty made a lot of noise during the game!,0,0.0
687,687, Instead we landed at a Rotary Club meeting about 15km from Udupi in Brahmavar where we received yet more beautiful flowers and were asked to talk about ourselves.,1,1.0
688,688, Very peaceful and serene.,0,1.0
689,689, We then head to Udupi beach where families have gathered to watch the sunset.,1,1.0
690,690, Most beaches are either crowded with tourists or deserted.,0,0.0
691,691, She has been an excellent host and I have loved sharing her beautiful home.,1,1.0
692,692, a beautiful hill overlooking the city of Udupi.,1,1.0
693,693, The people here are treated very well and the centre is clean and tidy.,1,1.0
694,694, We wore little plastic beanies when we went into the beautiful white marble mosque.,1,1.0
695,695, Everything is very loud and the main noise is car horns tooting and the whistles of road police and parking attendants.,0,0.0
696,696, Mithras house is beautiful and sits back from a main road through secure gates.,1,1.0
697,697, Mithras helper only works in the mornings to clean and wash.,1,1.0
698,698,"Peace Child was my first step into the world alone,",0,1.0
699,699, That moment was by far the calmest most peaceful moment of my life.,1,1.0
700,700," it was such a beautiful moment,",0,1.0
701,701,"Straight after lunch we left and headed to Berns the director of peace child,",0,1.0
702,702,and it is just a bonus I get to do that while looking at some of the most beautiful buildings/sites in the world.,1,1.0
703,703," After such a peaceful morning,",0,1.0
704,704, I think the guy had his horn and gas peddle pressed all the way down for 1 hour of the 1.,0,0.0
705,705," The beaches are beautiful,",0,1.0
706,706, and only the occasional honking of horns.,0,0.0
707,707," food and it is so built up that it was such a beautiful feeling just sitting on the sand with nothing,",1,1.0
708,708,The south of India is much more relaxed and easier!,0,1.0
709,709, It has a mix of natural beauty and ancient beautiful temples.,1,1.0
710,710, Air conditioned balcony rooms with fantastics views are a welcome sights after a 9 hour overnight flight!,1,1.0
711,711, except for the beautiful Indian jewellery in the duty free!,1,1.0
712,712,We travelled to Mangalore Club hotel for a relaxing evening before the work starts.,1,1.0
713,713,"The view from my room on the top floor is fantastic,",1,1.0
714,714, We are going to spend tonight relaxing and catching up on sleep.,1,1.0
715,715," bewildered and praying not to be ripped off i threw on my pack and walked into the crowd of taxi men,",0,1.0
716,716,"When i arrived at the peace child office i was once again greeted by Viji,",1,1.0
717,717, cleans and looks after you.,0,0.0
718,718, Juile another intern and Sammy who works full time for Peace Child were having there lunch inbetween teaching at two local primary schools.,1,1.0
719,719,If you haven't seen it yet (in the past couple posts from this trip) we are uncovering some beautiful gems who are going to be the fortune we need for a brighter future.,0,1.0
720,720, misconceptions and views that females are a curse not a blessing.,0,0.0
721,721, Udai Sagar and Swaroop Sagar-are considered among the most beautiful in Rajasthan.,1,1.0
722,722,"So after travelling up the Western Ghatts through the mountains we took a 9 hour bus journey to Bangalore,",1,1.0
723,723, sometimes near agriculture fields or under some teak tree forest.,0,0.0
724,724, The noises in that deadly silent area gave us a unique feeling.,0,1.0
725,725, Views are awesome with many a layers of hill after hill forming waves of ridges somewhere in the distance.,1,1.0
726,726, It gets steep and tiring but the views and the surroundings makes the walk a pleasure.,1,1.0
727,727, you are up in the spongy clouds with the majestic beauty of tremendous landscape around!,1,1.0
728,728, Its windy peak offers unhindered views of impressive mountain ranges and valleys of Coorg and beyond.,1,1.0
729,729," eventually disappearing into the mist somewhere faraway,",1,1.0
730,730,"Beholding the tremendous natural beauty of the scapes by all my senses,",1,1.0
731,731, hurling the crowd aside and crashing blindly through the maze of pillars.,0,0.0
732,732, noisy diesel engine hauling rickety wooden carriages with barred opening windows.,0,0.0
733,733," a narrow perfumed maze selling mountains of flower heads (for garlands),",1,1.0
734,734, always declining his offers of cheap prices to the sights (its actually a good hearty walk to Chamundi hill for its panoramic views over the city).,1,1.0
735,735,are transported back to that fleeting period when Indias beaches hit their tourist zenith: dispersed and discrete enclaves of beach huts that are almost invisible from the lustrous bays and yet serve all possible  backpacker - needs.,1,1.0
736,736," you can advance further along the wooded coastline to the very rustic Half Moon beach (15 mins) or yet further to Paradise (another 20 mins) where it is still primarily camping and self-reliance; but really,",1,1.0
737,737, There is (surely) no finer beach scene in India.,1,0.0
738,738, only local flop-houses that patently would not have been either secure or safe  located near the train station was surrounded by wine shops and grotty bars (many so grim that even we would not consider patronage) and by mid-afternoon the streets were littered with prone drunks.,1,0.0
739,739," This region of Karnataka is very agricultural and we passed golden fields of thirsty sunflowers with heavy bowed heads,",1,1.0
740,740," green fields of squat chenna (not sure if these are soya beans or chickpeas or something more exotic) and great expanses of sugar cane,",1,1.0
741,741, Remove the bloody television  saving on electricity  and pay someone to actually clean the room.,0,0.0
742,742, Indeed South East Asia is still backpacker heaven pricewise (just dont rely on Lonely-sell-out-Planet for any bargains) - even with 16 flight tickets and 16 visas we are still averaging a fraction under $40/day ($39.,1,1.0
743,743, something beautiful happens.,0,1.0
744,744,"so beautiful) and having them write a story inspired by the archeypal events the music follows,",1,1.0
745,745, with what looks like a beautiful pool.,0,1.0
746,746, We then had to take another rickshaw by lush fields and through small towns to the base of Anjaneya Hill.,1,0.0
747,747," we were welcomed by a beautiful view,",1,1.0
748,748," The view from was amazing,",0,1.0
749,749, clean mall.,0,1.0
750,750, but remember how I said that honking was the only mode of vehicle communication in India?,0,0.0
751,751, you'd just start to nod off and the bus horn would stab you through one ear and out the other.,0,0.0
752,752, and were pleased to find it clean and spacious.,0,1.0
753,753, and were almost immmediately greeted by a crowd of locals and a sprinkling of foreign visitors like us.,1,1.0
754,754,Bangalore has a slight traffic problem.,0,0.0
755,755," The traffic is the worst I've experienced in India,",0,0.0
756,756, and the inevitable result of the chaos makes for some prodigious traffic jams.,0,0.0
757,757," Bangalore is a cacophony of noise and traffic,",0,0.0
758,758, but the centre of the city based around Cubbin park is pleasantly clean and modern.,1,1.0
759,759, At the end of the day my auto driver was driving me back to the guesthouse when we got stuck in a traffic jam .,0,0.0
760,760,"walk along the beach in the afternoon,",0,0.0
761,761, Nothing stops him from climbing mountains to walking on his hands from Calgary to Edmonton.,1,1.0
762,762, this was probably the most beautiful and inspiring part of the journey.,1,1.0
763,763, The water was muddy and yellow so the sanitation process was going to be a long one before it can actually be clean for the families to use.,1,1.0
764,764, she cooks and cleans before going out to the fields to work.,1,1.0
765,765,"We stop by Bangalore on our way to Hampi (only briefly - it is not a nice place - it's a big dusty noisy and unappealing city,",0,0.0
766,766, Hampi is very green surrounded with the rice fields on one side and desertic landscape and Ruins on the other.,0,0.0
767,767, we visited the Hanuman temple monkey on the top of the mountain accessible by a 570 steps climb.,1,1.0
768,768,On my first day in Bangalore I visited this beautiful statue of Lord Shiva.,1,1.0
769,769,people who wrote and post about this beautiful place.,1,1.0
770,770,""""" or """"and here you see Ganesh lifting an entire mountain over his head,",1,1.0
771,771," and you can see the hunter on the mountain and the farmer,",1,1.0
772,772, They didn't badger at all like some beggars or vendors may do.,1,1.0
773,773," In the northwest corner of the temple there was a sort of elevated patio that was crowded with men and women,",0,0.0
774,774, so we wandered up the steps and crowded near the back of people.,0,0.0
775,775, because that placed is jammed with tourists.,0,0.0
776,776, and there was some beautiful stained glass from Glasgow.,1,1.0
777,777, I didn't get my precious beauty sleep because of the hotel call and I was not really able to get back to sleep after that.,0,1.0
778,778, for they guys' peace of mind.,0,1.0
779,779, because it was peak traffic hours and a bus would a) take FOREVER and b) be ridiculously crowded.,0,1.0
780,780, and a couple hours of chaos but we finally got to wear our saris!,0,0.0
781,781," After viewing several saris,",0,0.0
782,782, but things are barely held together by metaphysical tape and the chaos only shows through now and then.,0,0.0
783,783," then cleans it with water and cow dung (since cows are sacred this serves as cleansing and purification),",0,0.0
784,784, Things were still sketchy when viewed from the back of an auto-rickshaw (details below).,0,0.0
785,785, Anyone who has traveled to India knows: the traffic there operates on completely different rules than it does in the states.,0,0.0
786,786," use your horn often to let people know where you are,",0,0.0
787,787, voicing frustrated complaints in tones of voices that would probably have someone intervening in America with calming comments.,0,0.0
788,788," There were ladies cleaning in the bathroom,",0,0.0
789,789, and I think that me trying to clean up after myself might have been insulting their hospitality.,0,0.0
790,790, It was very crowded and we could not enjoy the garden since it was already dark.,0,0.0
791,791, Finally I stopped the car in a crowded area and asked what he wants.,0,0.0
792,792, looked very clean and have very friendly staff.,1,1.0
793,793," The zoo was pretty crowded but since it is a huge area,",0,1.0
794,794, the crowd did not make it uncomfortable.,0,1.0
795,795, and the car horn is a well developed but little understood language by foreigners.,0,1.0
796,796, You can see a distant view of a Dam built for irrigation purposes.,1,1.0
797,797, people are there to have some quite and relaxing time with the nature and nurture the trees and plants.,1,1.0
798,798, away from the crowd and pollution of cities like Bangalore?,0,1.0
799,799, a python sleeping in a tree; it is a peaceful and beautiful place.,0,1.0
800,800," Somehow I got a semi-broken bike; it made alarming and loud noises with each revolution,",0,0.0
801,801,During lunch time I noticed a crowd was moving near lunch area.,0,0.0
802,802, When I went near the crowd I saw the crowd was around Brahmarshi Patriji.,0,0.0
803,803, sometimes interpreting English speeches into Telugu and sometimes stimulating the crowd with humorous comments.,1,1.0
804,804,Meditating on the flute music was a beautiful experience.,1,1.0
805,805, When I saw a big crowd near toilets I decided to have breakfast first fearing that the food might finish if I make late.,0,0.0
806,806, I discovered a beautiful Shani temple.,1,1.0
807,807,There is a beautiful statue of lord Shiva in Tapasthali.,1,1.0
808,808, The views of the hills and the valley were beautiful.,1,1.0
809,809, Patriji also mesmerized the audience with his beautiful songs and speeches.,1,1.0
810,810, I was quite impressed to see such a big crowd coming from different parts of the country.,0,1.0
811,811, I was really enjoying the scenic pleasures and was thinking about my next journey from Gonnikopal to Kutta which was around 36 kms.,1,1.0
812,812, I spent some time noticing the local crowd and their styles.,0,0.0
813,813," After spending a few gazing moments at the Coorgi beauties (as people may not know,",1,1.0
814,814,The drive from Gonnikoppal to Kutta was perhaps one of the most scenic bus journeys Ive ever had.,1,1.0
815,815," The entire journey seemed to be the same through estates and finally around 3:30pm the Green Beauty (Eventually,",1,1.0
816,816," Though Irpu was a small waterfall compared to the mightiest I have seen in India,",1,0.0
817,817," What a beautiful place it was and if you were there with your sweetheart,",0,1.0
818,818, When we came back the next day we discovered it's multiple beautiful rooftop terraces and - our favourite element - an indoor swing!,1,1.0
819,819," if slightly chaotic appearing,",0,0.0
820,820, I'm so impressed that Sagar can drive here - I think that's why he's such a calm guy in Toronto.,0,1.0
821,821, we took a walk around the beautiful grounds.,0,1.0
822,822," There were so many beautiful lush bushes,",1,1.0
823,823," There was a big waterfall that you could sit under,",0,1.0
824,824, will traffic be OK.,0,1.0
825,825, no one is able to go very fast in the bad traffic so I feel like if we got hit we wouldnt get TOO hurt (my mom just had a heart attack when reading that).,0,0.0
826,826, It was a much more relaxed atmosphere though with much giggling and whispering than would be acceptable at home.,0,1.0
