,Unnamed: 0,Review,Rating,sentiment
299,299,"The view from Hanuman's temple is out of the world,",1,1.0
300,300," Truly one of the best views I've had on the trip,",1,1.0
301,301, off to Gokarna and the beach for some much needed rest.,0,0.0
302,302, Brigade road is quite beautiful in its architecture.,1,1.0
303,303,is looking more beautiful because it is a pleasant morning and also it is Sunday but in evening it is crowded.,1,1.0
304,304,Buss stop is clean and bigger (it is located at outskirts of Bangalore) compare to other stops.,0,0.0
305,305, we are concern about the view the something happens.,0,0.0
306,306, The most latest addition in beauty of bunnergutta national park.,1,1.0
307,307, It is quite beautiful it is started in 2005.,0,1.0
308,308,A beautiful statue of butterfly is made outside the park and you get surprise when you go inside.,1,1.0
309,309,Structure is also beautiful(dome shape).,1,1.0
310,310," but also beautiful walk throughs surrounded by natural vegetation,",1,1.0
311,311, We sauntered quiet too fast while the rest from my gang was indulged in clicking the wildlife.,1,1.0
312,312, it the prime view point where one can see the whole of Mysore City.,1,1.0
313,313,Well we got togged up and enjoyed a very nice drink in the rather plush Harbour Bar at the lavishly beautiful Taj Mahal Palace Hotel in Mumbai.,1,1.0
314,314, wonderfully colourful as many of the properties were decorated in fairy lights and so very noisy with fireworks being let off all the time.,1,1.0
315,315, The sheer volume of people was a little overwhelming at times - the population of Mumbai is 18.,1,1.0
316,316," Beautiful scenery,",0,1.0
317,317, fabulous golden sandy beaches and the warm Arabian sea - a real tonic for the soul.,1,1.0
318,318, We chose to stay way down South in Palolem and very pleased we did as it was a lovely quiet resort with a wonderful bay.,1,1.0
319,319, There are also fabulous views up here over the city.,1,1.0
320,320, open-air with main exhibit being the Mysore Maharani's saloon (a wood-panelled beauty dating from 1899).,1,1.0
321,321,- St Philomena's Cathedral built between 1933 and 1941 in neo-Gothic style with beautiful stained glass windows.,1,1.0
322,322, don't sound horns and don't project lights etc.,0,0.0
323,323, we fathomed the real meaning of beauty in the nature.,1,1.0
324,324," and peace will be at your feet"""",",0,1.0
325,325," We didnt know we had to walk 3km to see the falls (view point),",0,0.0
326,326, and trek down further 2km from the view point to get wet!,1,1.0
327,327," The narrow and rugged pathway to the view point allow some vehicles (small cars and jeeps) to travel through; there are also paid jeep services to get you to the view point,",1,1.0
328,328,"The view of the falls exceeded our imagination; Kumardhara River gushing through the valley and falling into the 200 feet deep gorge,",1,0.0
329,329, Beauty has a new meaning= Relief!,0,1.0
330,330," there was also a beautiful garden and many shrines where monks meditate,",1,1.0
331,331, reminiscing this awesome five day trip; thoughts of which would haunt us forever into the beauty of friendship.,0,1.0
332,332, We werent able to appreciate the beautiful route to the beach town.,1,1.0
333,333,The beach was just optimally crowded.,1,1.0
334,334, There were several beaches separated by small hills.,0,0.0
335,335, On the last beach in the row we hired a boat which took us to the beaches not easily accessible.,1,0.0
336,336, We could see big mountains directly merging into the ocean.,1,1.0
337,337, The beaches were surrounded by mountains on three sides and had ocean on the fourth.,1,1.0
338,338,Once again we ended up traveling in the dark and missed the beautiful part of the journey.,0,1.0
339,339, The landscape on both sides of the road comprised endless uniform green fields with stony hills and coconut trees as the only aberrations.,1,1.0
340,340, The monastery was a beautiful place.,1,1.0
341,341, The early morning light slants through the trees and a light mist rises off the water.,1,1.0
342,342," along with his gorgeous wife and brother-in-law,",0,1.0
343,343, when I realised how beautiful it was to watch someone embodying my movement and how powerful this is to witness.,1,1.0
344,344,"So let me start today by mentioning that as I left the house I saw 3 beautifully dressed transexuals walking down my street,",1,1.0
345,345, the home town of the lady (I prefer not to use peoples names out of respect) so I can see the farmlands and some beautifully hidden/non tourist regions.,1,1.0
346,346," it was further delayed due to a small traffic incident,",0,0.0
347,347," The view was spectacular,",0,0.0
348,348, It was a beautiful sunny day also so this was a wonderful experience especially the stones burning the underside of my feet making me literally want to run up and down the hill.,1,1.0
349,349,"animals and Karma sutra positions carved around the outside of a gorgeous temple,",1,1.0
350,350, horns honking.,0,0.0
351,351," It truly has to be seen for one to even grasp how crazy it is on the road (there is 'no traffic' right now either because it's so early,",1,1.0
352,352," but some how in all the chaos the people seem to manage,",0,0.0
353,353," honked at as I need to take the road because the foot path is non existent,",0,0.0
354,354," I'm sitting outside the place now being stared down by the cleaning ladies,",0,0.0
355,355," by 5am a beautiful singing can be heard,",1,1.0
356,356," How expressive and beautiful this dance is,",1,1.0
357,357," I see the dirt and rubbish in the street,",1,0.0
358,358, how is this chaos possible?,0,0.0
359,359,Hello you beautiful people.,0,1.0
360,360, in a clean and safe apartment in Bangalore.,1,1.0
361,361,we thought we were back on track but got scared as l read about mountain bears roaming around and also we saw a LOT of HUGE monkeys (rabies alert) up where we wanted to be.,0,1.0
362,362, probably best we were able to sleep so couldnt hear all the horns and feel the swerving of the bus all night making our minds race!,0,1.0
363,363, our poor tummies were not used to processed rubbish in those pizza's.,1,0.0
364,364,We relaxed the rest of the day in preparation for the following long day to come.,0,1.0
365,365,this was not going to happen so around 8am we headed to the botanical gardens and had a lazy wander looking at the pretty flowers and relaxed sanctuary away from the hustle and bustle of Bangalore.,1,1.0
366,366, playing very loud music all night which meant we generally spent the time not very relaxed and feeling like we were being tortured as the music was so loud you couldn't sleep.,0,0.0
367,367, Ride from our hotel to Hampi was wonderful with an amazing view of paddy fields on one side of the road and sugar cane farms on the other side.,1,1.0
368,368," Crowd was less as it was an off-peak season due to summer temperatures,",1,1.0
369,369," Then we headed to Tunga Badra Dam to view the sunset,",1,1.0
370,370, where we hiked a nearby hill to get a better view of the horizon.,1,1.0
371,371, We returned happily with minds full of memories about that beautiful city.,1,1.0
372,372, Just the hour in a traffic jam then.,0,0.0
373,373,Our last day in India was supposed to be a quiet day with nothing to do.,0,0.0
374,374, Traffic chaos and mayhem beyond description.,0,0.0
375,375, the good news is that the hotel is clean and the room comfortable (though it is a shame that there is an external light pointing straight into our bedroom through the exceedingly thin curtains).,1,1.0
376,376, surrounded by aggressive hawkers and beggars clawing at us.,0,0.0
377,377," beautifully decorated inside but in need of some serious renovation,",1,1.0
378,378," So far it is looking like a good choice  a clean room,",1,1.0
379,379," The noise level rose to deafening proportions,",0,0.0
380,380, assorted beggars and that man who is trying for the second day to sell us a flute on which he plays the first few bars of Titanic.,0,0.0
381,381, A small crowd gathers at the door to stare and giggle at the two overheated Englanders.,0,1.0
382,382, as do fields of sugar cane and rice paddies.,1,1.0
383,383, Gone are the fields of wheat and cotton.,0,0.0
384,384," The views as we gradually ascended the cliff were impressive,",1,1.0
385,385,provide a water supply but now sadly too polluted to be drunk.,0,0.0
386,386, bustle and apparent chaos can be slightly overwhelming.,0,0.0
387,387, followed by a relaxing afternoon reading and sorting photos.,0,1.0
388,388, but very evocative and with some beautiful carvings.,1,1.0
389,389," a calm oasis in the countryside that is clean,",1,1.0
390,390,Last view of Varkala beach.,1,0.0
391,391,"coastal beach places,",1,1.0
392,392,"I can now walk in any beach restaurant in Kerala,",0,0.0
393,393, After so many weeks in Beach Huts I am getting desperate for a change of scenery.,0,0.0
394,394,"Neriman however is just at the start of her trip so these places hold the same appeal as they did for me when I arrived (remember the life is a beach comments,",1,1.0
395,395, Maybe the fish ate the rubbish and all died.,0,0.0
396,396, Besides monkeys and dogs there were some beautiful wild vivid green parrots flying around and our guide said this is the only temple where they hang out and for sure they were the only ones we saw during our stay.,1,1.0
397,397," There is a special peacefulness amongst the mingling of cows,",1,1.0
398,398," As it was Republic Day the school children were all dressed up in clean uniforms,",0,1.0
399,399,The elephants had a view out of big doors ways that are now open.,1,1.0
400,400,an old Vishnu Tempel which was also very beautiful and overall peaceful.,1,1.0
401,401, But it was really beautiful with some amazing architectural details.,1,1.0
402,402, but all were happy and peaceful and we simply had a great time taking this all in.,1,1.0
403,403," cows with painted horns adorned like an Indian bus,",0,1.0
404,404,"The road down the mountain towards Mysore was rough and rugged but travelled through National reserves so we were entertained with flocks of pretty spotted deer,",0,1.0
405,405," The palace was spectacular and is the official residence of the Wodeyars,",1,1.0
406,406, crisp clean sheets and thick luxury towels- oh so mmmmmmmm.,1,1.0
407,407, Bangalore is ( according to the guide) the largest city in India with a population of close to 2 million.,1,0.0
408,408, The parks were quite clean and clearly actively managed.,1,1.0
409,409, One the outskirts we drove up a mountain to see the Chamundeshwari temple right on the top.,1,1.0
410,410,Down towards Mysore on the other side of the mountain we had a good overview of historical Mysore.,1,1.0
411,411," Mysore seemed clean and quite regal,",0,1.0
412,412," 15 beautiful saris were purchased for the girls,",1,1.0
413,413, jam and pawpaw.,0,0.0
414,414," with streamers and glitter coming off their horns In the Mysore paper that morning,",0,0.0
415,415, Beautiful tress in the actively renovated garden.,1,1.0
416,416,spectacular hall for royal weddings.,1,1.0
417,417, Spectacular statues of jaguars guarded the palace.,1,1.0
418,418, That was worth waiting for  the absolutely beautiful havelis were amazing to say the least with all the fresco work and tiling.,1,1.0
419,419, We were absolutely blown away with the beauty of them  got to see a lot from the outside and then were able to tour through the whole of one.,0,1.0
420,420, is a very beautiful place which I had been waiting to explore since quite sometime now which finally we (me and my husband) managed to plan it in December 2013 from 21st to 25th.,1,1.0
421,421," Hampi is the former capital of Vijaynagar Empire where you can see beautiful Virupaksja temple,",1,1.0
422,422," Along with the beautiful Hampi ruins,",0,1.0
423,423, They also had rice fields which added to the beauty.,0,1.0
424,424, You get a beautiful view of the entire Hampi from both the hills.,0,1.0
425,425, we truly enjoyed seeing the view and wish could be on the hills every evening to see the sunset.,1,1.0
426,426,"I now have a beautiful sari (whose blouse is being tailored today,",1,1.0
427,427, It was a beautiful old house with lots of dark rich wood and seemed to be built around what would have been 2 small bathing pools.,1,1.0
428,428," but we were doing battle with Mosquitos which carried on for our entire stay,",0,0.0
429,429, A couple of times we would have to stop as they had got in a tangle ahead of us and someone had to get out of a vehicle to make others move back to allow the traffic to move.,0,0.0
430,430, Full of people and noise but fairly clean which was good to see.,0,1.0
431,431, It is a regular passenger service but travels through beautiful countryside so is popular with tourists.,1,1.0
432,432," noisy town,",0,0.0
433,433," we went to Mysore Palace which was pretty spectacular though the Maharajah has just died,",1,0.0
434,434," the architecture was beautiful and the detailed carving was stunning,",1,1.0
435,435," We went into the paddy fields where they were cutting it and another where they were collecting it,",1,0.0
436,436,"Bangalore was a traffic jam,",0,0.0
437,437,Forty-five minutes later I was rooting for the auto driver as he dodged traffic to get to the bus stand and then before I took stock of things I was on the bus en route to Gokarna with S.,0,0.0
438,438, named so as the beach seems to spell out Om the way it is written in Sanskrit.,1,1.0
439,439, it is quiet and deserted.,0,0.0
440,440, He says we Indian women are beautiful and the woman swats his arm and laughs.,0,1.0
441,441,We stop for a beer at a shack on Kudle beach and the decision is unanimous.,1,0.0
442,442, We are trading Om Beach for Kudle.,0,0.0
443,443, the bendy soft grasses brushing our legs and at High Point the views stops us.,1,1.0
444,444, These steep climbs turn into mini waterfalls during the monsoons we are told.,1,1.0
445,445,Later an older crowd starts coming out.,0,0.0
446,446, crowds of people sit out on the beach.,0,0.0
447,447, I was restored and I made peace with the world.,1,1.0
448,448, The place was crowded with Indian tourist.,0,0.0
449,449,"there were thousands of them and the noise of them chattering,",0,0.0
450,450," we left the lake and walked back into the village which has a beautiful collection of old,",1,1.0
451,451," It was pitch black outside and very quiet so we stayed in bed for another half an hour before braving the cold,",1,1.0
452,452," The gates of the resort were locked so we had to find a boy with a key first but then we walked out onto the field to the sound of krrking and cranes as far as the eye could see,",0,0.0
453,453, The noise was incredible!,0,0.0
454,454, Occasionally there would be a temporary quiet as they all looked up from the seed they were eating and often a group would all take off together and the krrking would build up again.,0,1.0
455,455, This peak offers very nice panoramic view of the Tungabhadra region.,1,1.0
456,456, This temple houses the most spectacular structure called The Stone Chariot.,1,1.0
457,457, If you have enough time you can covers the nearby places which do passes amazing beauty of tranquillity else you can head straight towards main road.,1,1.0
458,458,This small temple town draws crowds who come mainly to pay obeisance to the presiding deities of the navagraha temples.,1,0.0
459,459,One could also include Thanjavur in the itinerary which is known as the granary of South India due to its extensive paddy growing fields which are a feast for the eyes'As regards accomodation at Kumbakonam one can pick and choose an accomodation suited to one's budget.,1,1.0
460,460, Rivers like Tunga - Bhadra have their sources in the mountains here which are parts of the Western Ghats.,1,1.0
461,461,The city is placed within a scenic landscape in a fertile valley; it is surrounded by lush green coffee plantation hills.,1,1.0
462,462, The road to Mullayanagiri is very narrow with views from steep cliffs.,0,0.0
463,463, We often stopped and captured the fairy tale scenic views on the way.,1,0.0
464,464, We could not spent a long time near the waterfall and getting wet and dark.,0,0.0
465,465, The site featuring this beautiful waterfall is a popular climbing spot.,1,1.0
466,466, The 100 ft waterfall can be accessed from 400 steps that are climbed down from the main road to reach the site.,1,1.0
467,467,The dam gives an awesome views for photo enthusiasts and peace of mind for nomads .,1,1.0
468,468, with relaxing and reading on the floor cushions of the local restaurants and cafes.,1,1.0
469,469," after a fairly relaxing time in Kodai,",0,1.0
470,470," dodging traffic as well as a few goats and cows,",0,1.0
471,471, we finally found ourselves a hotel in which to have lunch and more importantly to get away from the chaos of the streets.,0,0.0
472,472, we decided to head into the epicentre of chaos and to take a look around the Devaraja Market.,0,0.0
473,473, The other thing I remember thinking on the bus was how bright the lights were from the oncoming traffic in the other lane.,0,1.0
474,474, especially in the chaos we were exposed to!,0,0.0
475,475,"15/01/16 Arrive in beautiful Pathankot for breakfast and join my Rajastan bound sleeper train @ 11am,",1,1.0
476,476," long peaceful lunch break on the scrub dunes before more riding to our sunset sleeping spot,",1,1.0
477,477, 19/01/16 wake up for beautiful sunrise before stomping back to start point & return jeep to Jaisalmer.,0,1.0
478,478, beautiful palace there we were going to tour.,0,1.0
479,479, We had to get the paper handed to us by the lady who looked like she was there to clean the bathroom.,0,1.0
480,480, I dont think I have seen a much more beautiful palace in all the world.,0,1.0
481,481, Various beautiful murals in every all.,1,1.0
482,482, provided a lot of insight on the city as we were passing through in the mid-morning traffic jam.,0,0.0
483,483,we waiting a beggar with a baby came up to us and kept grabbing at us.,0,0.0
484,484," The traffic was heavy and congested by American standards,",0,0.0
485,485, It was nice having the guide because then all the beggars left us alone.,0,1.0
486,486, We saw a lot of different vegetation and beautiful flowers.,1,1.0
487,487, a long winding ride through narrow heavily clogged roads with traffic and construction to reach after almost an hour or so.,0,1.0
488,488,'Hampi' explores one of the most beautiful and evocative of all historical sites in south India.,1,1.0
489,489, And dealing with such questions is quiet difficult.,1,0.0
490,490, It was quiet far from our house but drive was fun indeed.,0,1.0
491,491, We spent most of the 2 days just chilling in either the huge mall just around the corner or relaxing in our hotel rooms watching tv.,1,1.0
492,492,"arrived in Bangalore just in time for rush hour traffic which meant we were stuck in hot,",0,0.0
493,493, loud traffic for about 2 hours longer than we should have been.,0,1.0
494,494," They call it the Venice of India: I would argue that it is even more beautiful than Venice,",1,1.0
495,495," The rest of our time was spent on the backwaters exploring small villages and taking in the view from the water of the women on shore making string out of coconut husks,",1,0.0
496,496," Palolem beach is my favorite beach in India,",1,1.0
497,497," so the beach was not busy,",0,0.0
498,498," balancing headphone parties and fire dancing/poy on the beach with trying to find internet occasionally to let people know we were alive or finish final papers and assignments,",0,1.0
499,499," We are staying in an all girls residence which is very clean and safe,",1,1.0
500,500,"Our second placement weekend was spent in the beautiful city of Mysore,",1,1.0
501,501," The food situation only got better as we decided to splash out for our Saturday dinner and go to a beautiful hotel for an afternoon and evening of fruit platters,",1,1.0
502,502, We returned in the evening for the promised light spectacular display of the 42000 bulbs lining the palace.,1,1.0
503,503, The temple itself is a beautiful white building perched on top of a hill with an incredible view of Mysore.,1,1.0
504,504, However the rest of India decided they also wanted to witness its beauty on the same day.,0,1.0
505,505, where I was eaten alive by mosquitos and - for the first (and hopefully last) time during my travels - was attacked by a spider.,0,1.0
506,506," Once I had calmed my breathing,",0,1.0
507,507,My first observation of Indian roads was that drivers use their horns more than any other function on their cars/autos/mopeds.,0,0.0
508,508," it's hard to hear yourself think over the constant honking and bibbing,",0,0.0
509,509, they are just as oblivious to the honking horns and bustling traffic as the drivers are to the sight of cattle strolling in their paths.,0,0.0
510,510, I also took a lot of pictures and videos of the beautiful place.,1,1.0
511,511, both very beautiful and very attractive.,0,1.0
512,512, Especially in the evening it is very peaceful to sit here in the courtyard in front of the statue and stare at the statue.,1,1.0
513,513,(View this article and other travel articles in travelindia.,1,1.0
514,514, The sea looks clean but is more for surfers than swimmers.,1,1.0
515,515,picnic site (judging by the litter left around!,1,1.0
516,516, with sculpture workshops everywhere and either the gentle noise of stone chiselling or the whirring din of stone cutting machines.,1,1.0
517,517, where we are to catch our overnight train to Metupalaiyam and (hopefully) the early morning connection with the Mountain Railway steam train up to Ooty.,1,1.0
518,518,The overnight journey went well and in fact we arrive into Metupalaiyam 30 mins early; great as it means time for a couple of good hot coffees and lots of photos of the Nilgiri Mountain Railway narrow gauge steam train and steam engines before we set off.,1,1.0
519,519, one on each side of the carriage so we get the best photo opps of the views all the way up.,1,1.0
520,520, This gets us to decide that 1 night will definitely be enough (a view that is confirmed later when we wander into town for some lunch) as it seems a very non-descript place despite the colourful houses.,0,1.0
521,521," Its also clean and has good information counters,",1,1.0
522,522,) And finally the Kings private audience room  again the ceiling is a beautifully coloured stained glass marvel of craftsmanship.,1,1.0
523,523," Its not quite worth the journey in our view  but Indians love gardens,",0,1.0
524,524, The station at B is pretty big and clean and they have a left luggage counter which we use so that we might explore the city a bit.,0,1.0
525,525," a last minute substitute for the hills and mountains of Darjeeling and Sikkim,",1,0.0
526,526, the next beautiful attraction of the temple is the garden.,1,1.0
527,527, The garden has beautiful grass lawn and excellent collection of various plants.,1,1.0
528,528, The environment is very cool and peaceful and you will definitely enjoy to sit for some time inside the temples.,1,1.0
529,529,Although the temple is recently built it has the peace and piousness of old temples.,1,1.0
530,530, attractive and surrounded by beautiful lawns and trees.,1,1.0
531,531, you can find several idols of Mother Mary near the church with beautiful decorations.,1,1.0
532,532," Although the crowd is there for the whole day,",0,0.0
533,533, The security forces create cordons around the church and dont allow the crowd to go inside.,0,1.0
534,534,"A chariot is decorated with beautiful flowers,",1,1.0
535,535,The Chariot is beautifully decorated.,1,1.0
536,536, Especially the lights are arranged in a beautiful way.,1,1.0
537,537," As the Shivaji nagar area is more populated by the Muslims,",0,0.0
538,538, Besides on the day of Marys feast the traffic police will not allow any vehicle to enter from a km.,0,0.0
539,539, you can take beautiful pictures of mother Mary and other views around.,1,1.0
540,540, We saw a beautiful Vimana (below) which is used to carry the idol during festivals.,1,1.0
541,541,The temple has a traditional look with beautiful sculpture.,1,1.0
542,542, Painting with beautiful colors has made it even more attractive.,0,1.0
543,543, you will get some beautiful temples within a kilometer radius.,1,1.0
544,544,There are two Beautiful Nakoda Jain temples on both sides of the highway.,1,1.0
545,545, They are beautiful and worth visiting.,0,1.0
546,546, admiring the view of theBlueCity in the distance before retreating to the comfort of my bed for the day.,1,1.0
547,547, They spoke of aggressive beggars and said the city as a whole was generally underwhelming.,0,0.0
548,548," walking along a busy crowded footpath,",0,0.0
549,549," The last thing I wanted was this person trying to clean me up After trying to wash it off unsuccessfully,",1,0.0
550,550, We eventually found the restaurant and had a really beautiful meal.,1,1.0
551,551, Akshay took me up onto the roof of the guesthouse to show me the beautiful palace nearby!,0,1.0
552,552, Thank God for Akshay and his beautiful little family!,1,1.0
553,553, The waterfall is nestled among the amazing ranges of rocks.,1,1.0
554,554, You can park your vehicle in the open field there and walk inside the rocky area.,0,1.0
555,555,While coming from Ramagaram to Kanakapura you will find a beautiful arch on the left side of the road (right side while coming from Kanakpura to Ramanagaram).,1,1.0
556,556,Veerabhadra swamy temple is built with beautiful architecture.,1,1.0
557,557,The beauty of the temple is that it is built on huge granite stones.,1,1.0
558,558, The outside views from this hill are very attractive.,0,1.0
